NCT Number,Study Title,Study URL,Study Status,Brief Summary,Study Results,Conditions,Interventions,Primary Outcome Measures,Secondary Outcome Measures,Other Outcome Measures,Sponsor,Collaborators,Sex,Age,Phases,Study Type,Start Date,Completion Date,Locations
NCT05707910,Clinical Study of Therapeutic Immunological Agent for EBV-positive Advanced Malignant Tumors,https://clinicaltrials.gov/study/NCT05707910,UNKNOWN,"To evaluate the safety of therapeutic immunological agent against EBV-positive advanced malignancies, examining the incidence, type of occurrence, and severity of adverse events in relation to the agent tested, and initially exploring the effectiveness of the immunological agent.",NO,Malignant Tumor,BIOLOGICAL: EBV immunological agent,"Adverse events, Adverse events defined as the number of participants with adverse events according, up to 12 months|Objective response rate, ORR is defined as the percentage of patients who achieve a response, which can either be complete response (complete disappearance of lesions) or partial response (reduction in the sum of maximal tumor diameters by at least 30% or more), up to 12 months|Progress-Free Survival, PFS is defined as the time from the administration of the first dose to first disease, up to 12 months|Overall Survival, OS is defined as the time from the administration of the first dose to death., up to 12 months",,,West China Hospital,,ALL,"ADULT, OLDER_ADULT",PHASE1,INTERVENTIONAL,2023-02-10,2025-01-01,"West China Hospital, Chendu, Sichuan, 610041, China"
NCT03931720,Clinical Research of ROBO1 Specific BiCAR-NK/T Cells on Patients With Malignant Tumor,https://clinicaltrials.gov/study/NCT03931720,UNKNOWN,"Immunotherapy has become the major breakthrough and the most promising treatment, with the host of development of tumor biology, molecular biology and immunology. ROBO1 is a potential target and spectacular paradigm in the diagnosis and treatment of solid tumors. This study is for evaluation of the safety and efficacy of ROBO1 CAR-NK/T cell immunotherapy for malignant tumors.",NO,Malignant Tumor,BIOLOGICAL: BiCAR-NK/T cells (ROBO1 CAR-NK/T cells),"Occurrence of treatment related adverse events as assessed by CTCAE v4.03, Defined as \>= Grade 3 signs/symptoms, laboratory toxicities, and clinical events) that are possibly, likely, or definitely related to study treatment., 1 year",,,"Asclepius Technology Company Group (Suzhou) Co., Ltd.",,ALL,"ADULT, OLDER_ADULT",PHASE1|PHASE2,INTERVENTIONAL,2019-05,2022-05,"Department of Oncology, Suzhou Kowloon Hospital, Shanghai Jiaotong University School of Medicine, Suzhou, Jiangsu, 215021, China"
NCT02167581,Confrontation Phenotypes and Genotypes of Epithelial Odontogenic Tumors of the Jaws,https://clinicaltrials.gov/study/NCT02167581,COMPLETED,"Systematically compare the phenotype and genotype of epithelial odontogenic tumors in children and adults with a clinical, radiographic, pathologic and molecular level.

Either:

establish an observatory of this multidisciplinary tumor establish a tumor bank annotated scale unparalleled testing pathophysiological hypotheses search for prognostic factors.",NO,Epithelial Odontogenic Tumours,,"Phenotypic and genotypic lines connected to the epithelial odontogenic tumours, In particular, to define the link between the genotype PTCH1, the size of the tumor, its osteolytic character and the predictive factors of recurrence.

Data collection at M6, M12, M18, M24 from the surgery date, Month 24 from the surgery date",,,Assistance Publique - Hôpitaux de Paris,,ALL,"CHILD, ADULT, OLDER_ADULT",,OBSERVATIONAL,2011-01,2014-09,"Stomatologie et Chirurgie Maxillofaciale - Pitie Salpetriere, Paris, 75013, France"
NCT06764771,A Study of BMS-986488 as Monotherapy and Combination Therapy in Participants With Advanced Malignant Tumors,https://clinicaltrials.gov/study/NCT06764771,RECRUITING,"This purpose of this study is to determine if experimental treatment with BMS-986488, alone, or in combinations is safe, tolerable, and has anti-cancer activity in patients with advanced malignant tumors.",NO,Advanced Malignant Tumors,DRUG: BMS-986488|DRUG: Adagrasib|DRUG: Cetuximab|DRUG: Nivolumab,"Number of participants with Adverse Events (AEs), Until the end of the Safety Follow-up period (up to approximately 100 days after last dose)|Number of participants with Serious AEs (SAEs), Until the end of the Safety Follow-up period (up to approximately 100 days after last dose)|Number of participants with AEs meeting protocol-defined Dose-Limiting Toxicity (DLT) criteria, From first dose of study treatment until end of cycle 1 (1 Cycle = 28 Days)|Number of participants with AEs leading to discontinuation, Until the end of the Safety Follow-up period (up to approximately 100 days after last dose)|Number of deaths, From time of informed consent up to 52 weeks after end of treatment visit","Maximum observed plasma concentration (Cmax), Until Cycle 4, Day 1 (1 Cycle = 28 Days)|Time of maximum observed concentration (Tmax), Until Cycle 4, Day 1 (1 Cycle = 28 Days)|Area under the concentration-time curve in 1 dosing interval (AUC(TAU)), Until Cycle 4, Day 1 (1 Cycle = 28 Days)|Objective response rate (ORR), Defined as the proportion of participants who achieve a best overall response (BOR) of complete response (CR) or partial response (PR) assessed by the investigator using Response Evaluation Criteria in Solid Tumors version 1.1 (RECIST v1.1), From time of informed consent up to 52 weeks after end of treatment visit|Disease control rate (DCR), Defined as the proportion of participants who achieve a best response of CR, PR, or stable disease (SD) assessed by the investigator using RECIST v1.1, From time of informed consent up to 52 weeks after end of treatment visit|Duration of response (DOR), Defined as the time between the date of first documented response (CR or PR) to the date of the first documented disease progression as assessed by the investigator using RECIST v1.1 or death due to any cause, whichever occurs first, From time of informed consent up to 52 weeks after end of treatment visit",,Bristol-Myers Squibb,,ALL,"ADULT, OLDER_ADULT",PHASE1,INTERVENTIONAL,2025-03-25,2027-10-15,"John Theurer Cancer Center at Hackensack University Medical Center, Hackensack, New Jersey, 07601, United States|Local Institution - 0020, Allentown, Pennsylvania, 18103, United States|The West Clinic, PLLC dba West Cancer Center, Germantown, Tennessee, 38138, United States|Local Institution - 0025, Dallas, Texas, 75390, United States|Local Institution - 0031, Brisbane, Queensland, 4029, Australia|Local Institution - 0032, Vancouver, British Columbia, V5Z 4E6, Canada|Local Institution - 0015, Montréal, Quebec, H2X 0A9, Canada|Local Institution - 0016, Quebec City, Quebec, G1J 1Z4, Canada"
NCT05396391,A Clinical Trial to Evaluate Effect of IAP0971 in Patients With Advanced Malignant Tumors,https://clinicaltrials.gov/study/NCT05396391,RECRUITING,"This is a Phase I Clinical Trial to Evaluate the Safety, Tolerability and Preliminary Effectiveness of IAP0971 in Patients with Advanced Malignant Tumors.",NO,Advanced Malignant Tumors,DRUG: IAP0971,"To evaluate the safety of IAP0971 (Phase I), MTD/RP2D; Incidence and frequency of DLT; AE, SAE occurrence and frequency (according to NCI CTCAE 5.0)., Through finishing Phase I, an average of 1 year|To evaluate the effectiveness of IAP0971 (Phase IIa), Objective response rate(ORR), Until disease progression, assessed up to 3 years","Pharmacokinetics (PK) Cmax（Phase I), PK parameters Cmax following single dose, After single dose ,assessed up to 1 year|Pharmacokinetics (PK) Css,max（Phase I), PK parameters Css,max following multiple doses, After multiple doses ,assessed up to 1 year|Pharmacokinetics (PK) Css,min（Phase I), PK parameters Css,min following multiple doses, After multiple doses ,assessed up to 1 year|Pharmacokinetics (PK) Css,av（Phase I), PK parameters Css,av following multiple doses, After multiple doses ,assessed up to 1 year|Pharmacokinetics (PK) AUCss（Phase I), PK parameters AUCss following multiple doses, After multiple doses ,assessed up to 1 year|Pharmacokinetics (PK) CLss（Phase I), PK parameters CLss following multiple doses, After multiple doses ,assessed up to 1 year|Pharmacokinetics (PK) Vss（Phase I), PK parameters Vss following multiple doses, After multiple doses ,assessed up to 1 year|Pharmacokinetics (PK) R（Phase I), PK parameters R following multiple doses, After multiple doses ,assessed up to 1 year|Pharmacokinetics (PK) DF（Phase I), PK parameters DF following multiple doses, After multiple doses ,assessed up to 1 year|Pharmacokinetics (PK) Tmax（Phase I), PK parameters Tmax following single dose, After single dose ,assessed up to 1 year|Pharmacokinetics (PK) AUC0-t（Phase I), PK parameters AUC0-t following single dose, After single dose ,assessed up to 1 year|Pharmacokinetics (PK) AUC0-∞（Phase I), PK parameters AUC0-∞ following single dose, After single dose ,assessed up to 1 year|Pharmacokinetics (PK) CL（Phase I), PK parameters CL following single dose, After single dose ,assessed up to 1 year|Pharmacokinetics (PK) Vd（Phase I), PK parameters Vd following single dose, After single dose ,assessed up to 1 year|Pharmacokinetics (PK) t1/2（Phase I), PK parameters t1/2 following single dose, After single dose ,assessed up to 1 year|Pharmacokinetics (PK) λz（Phase I), PK parameters λz following single dose, After single dose ,assessed up to 1 year|To evaluate the immunogenicity of IAP0971 in patients with advanced malignant tumors (Phase I), Incidence of anti-drug antibody (ADA) and neutralizing antibodies (NAb) against IAP0971, After finishing Phase I, an average of 1 year|To evaluate the effectiveness of IAP0971 in patients with advanced malignant tumors (Phase I), Overall survival (OS) according to RECIST 1.1 or Lugano 2014, After finishing Phase I, an average of 1 year|To evaluate the effectiveness of IAP0971 in patients with advanced malignant tumors (Phase I), Objective response rate (ORR) according to RECIST 1.1 or Lugano 2014, After finishing Phase I, an average of 1 year|To evaluate the immunogenicity of IAP0971 in patients with advanced malignant tumors (Phase IIa), Incidence of anti-drug antibody (ADA) and neutralizing antibodies (NAb) against IAP0971, After finishing Phase IIa, assessed up to 3 years|o evaluate the effectiveness of IAP0971 in patients with advanced malignant tumors (Phase IIa), PFS according to RECIST 1.1 or Lugano 2014, After finishing Phase IIa, assessed up to 3 years|o evaluate the effectiveness of IAP0971 in patients with advanced malignant tumors (Phase IIa), DCR according to RECIST 1.1 or Lugano 2014, After finishing Phase IIa, assessed up to 3 years|o evaluate the effectiveness of IAP0971 in patients with advanced malignant tumors (Phase IIa), OS according to RECIST 1.1 or Lugano 2014, After finishing Phase IIa, assessed up to 3 years",,"SUNHO（China）BioPharmaceutical CO., Ltd.",,ALL,"ADULT, OLDER_ADULT",PHASE1|PHASE2,INTERVENTIONAL,2022-06-22,2024-11-30,"Shanghai East Hospital, Shanghai, Shanghai, 200120, China"
NCT04980690,Clinical Trial of IBC0966 in Patients With Advanced Malignant Tumors,https://clinicaltrials.gov/study/NCT04980690,RECRUITING,"This is a phase I/IIa study to evaluate the safety, tolerability and efficacy of IBC0966 for the treatment of subjects with advanced malignant tumors.",NO,Advanced Malignant Tumors,BIOLOGICAL: IBC0966,"Frequency of adverse events (AEs) and SAEs (Phase Ⅰ), To investigate the safety characteristics., 3 months after end event visit|Dose limiting toxicities (DLTs) (Phase Ⅰ), To determine the maximum tolerated dose (MTD) and the recommended Phase 2 dose (RP2D)., 28 days after first dose|Objective response rate (ORR) in dose expansion (Phase Ⅱa), To explore the clinical effectiveness. Tumor response based on RECIST 1.1 or Lugano 2014., Baseline through up to 2 years or until disease progression","Pharmacokinetic (PK) Cmax (Phase Ⅰ), PK parameters (Cmax) following single dose., Day1，2，3，7，14，21, 28 of DLT observation period , Day1of each subsequent cycle (each cycle is 7 days), and at the End of Treatment visit, up to about 2 years|Pharmacokinetic (PK) Tmax (Phase Ⅰ), PK parameters (Tmax) following single dose., Day1，2，3，7，14，21, 28 of DLT observation period , Day1of each subsequent cycle (each cycle is 7 days), and at the End of Treatment visit, up to about 2 years|Pharmacokinetic (PK) AUC 0-t (Phase Ⅰ), PK parameters (AUC 0-t ) following single dose., Day1，2，3，7，14，21, 28 of DLT observation period , Day1of each subsequent cycle (each cycle is 7 days), and at the End of Treatment visit, up to about 2 years|Pharmacokinetic (PK) AUC 0-∞ (Phase Ⅰ), PK parameters (AUC 0-∞) following single dose., Day1，2，3，7，14，21, 28 of DLT observation period , Day1of each subsequent cycle (each cycle is 7 days), and at the End of Treatment visit, up to about 2 years|Pharmacokinetic (PK) t1/2 (Phase Ⅰ), PK parameters (t1/2) following single dose., Day1，2，3，7，14，21, 28 of DLT observation period , Day1of each subsequent cycle (each cycle is 7 days), and at the End of Treatment visit, up to about 2 years|Pharmacokinetic (PK) λz (Phase Ⅰ), PK parameters (λz) following single dose., Day1，2，3，7，14，21, 28 of DLT observation period , Day1of each subsequent cycle (each cycle is 7 days), and at the End of Treatment visit, up to about 2 years|Pharmacokinetic (PK) Css,max (Phase Ⅰ), PK parameters (Css,max) following single dose., Day1，2，3，7，14，21, 28 of DLT observation period , Day1of each subsequent cycle (each cycle is 7 days), and at the End of Treatment visit, up to about 2 years|Pharmacokinetic (PK) Css,min (Phase Ⅰ), PK parameters (Css,min) following single dose., Day1，2，3，7，14，21, 28 of DLT observation period , Day1of each subsequent cycle (each cycle is 7 days), and at the End of Treatment visit, up to about 2 years|Pharmacokinetic (PK) AUCss (Phase Ⅰ), PK parameters (AUCss) following single dose., Day1，2，3，7，14，21, 28 of DLT observation period , Day1of each subsequent cycle (each cycle is 7 days), and at the End of Treatment visit, up to about 2 years|Objective response rate (ORR) in dose escalation (Phase Ⅰ), Tumor response based on RECIST 1.1 or Lugano 2014., Baseline through up to 2 years or until disease progression|Incidence of adverse events (AEs) and SAEs (Phase Ⅰ), To investigate the safety characteristics., 3 months after end event visit|Immunogenicity of IBC0966 (Phase Ⅰ), The frequency of anti-drug antibodies (ADA) against IBC0966.(Phase Ⅰ), 3 months after end event visit|Progression free survival (PFS) (Phase Ⅱa), PFS as assessed using RECIST 1.1 or Lugano 2014., Baseline through up to 2 years or until disease progression|Overall survival (OS) (Phase Ⅱa), OS as assessed using RECIST 1.1 or Lugano 2014., Baseline through up to 2 years or until disease progression|Disease control rate (DCR) (Phase Ⅱa), DCR as assessed using RECIST 1.1 or Lugano 2014., Baseline through up to 2 years or until disease progression|Incidence of adverse events (AEs) and SAEs (Phase Ⅱa), To investigate the safety characteristics., 3 months after end event visit|Immunogenicity of IBC0966 (Phase Ⅱa), The frequency of anti-drug antibodies (ADA) against IBC0966.(Phase Ⅱa), 3 months after end event visit",,"SUNHO（China）BioPharmaceutical CO., Ltd.",,ALL,"ADULT, OLDER_ADULT",PHASE1|PHASE2,INTERVENTIONAL,2021-08-31,2025-12,"The Affiliated Tumor Hospital of Harbin Medical University, Harbin, Heilongjiang, 150081, China"
NCT05450744,131I-TLX-101 for Treatment of Newly Diagnosed Glioblastoma (IPAX-2),https://clinicaltrials.gov/study/NCT05450744,RECRUITING,"This is an open label, single arm, parallel-group, multicentre, and dose finding study to evaluate the safety of ascending radioactive dose levels of 131I-TLX101 administered intravenously in combination with best standard of care in newly diagnosed GBM patients.",NO,Neoplastic Disease|Glioblastoma|Glioblastoma Multiforme,DRUG: 131I-IPA,"Incidence rate and the grade (severity) of DLTs, Incidence rate and the grade (severity) of DLTs based on the occurrence of Adverse Events (AEs) reported according to the NCI CTCAE v6.0. DLTs include any grade ≥ 3 events considered possibly related to the study drug, but excludes cerebral oedema, and haematological toxicity., 8 weeks from the first dose of IMP until discharge from the second dosem, up to 62 weeks.|Safety, tolerability and RP2D, Assessing TEAEs type according to MedDRA (Medical Dictionary for Regulatory Activities), frequency, severity according to National Cancer Institute Common Terminology Criteria for Adverse Events (NCI CTCAE) V5.0, seriousness, and relationship of study treatment will be assessed. Laboratory abnormalities will be assessed according to the NCI CTCAE V5.0., From screening until end of study, assessed over 62 weeks. TEAEs - units are frequency (percentage) and severity. Laboratory - safety laboratory including liver functions test, report mean and out of range.",,,Telix Pharmaceuticals (Innovations) Pty Limited,,ALL,"ADULT, OLDER_ADULT",PHASE1,INTERVENTIONAL,2023-04-01,2025-06,"Gold Coast University Hospital, Gold Coast, Queensland, Australia|Royal Adelaide Hospital, Adelaide, South Australia, Australia|Olivia Newton John Cancer Research Institute/Austin Health, Melbourne, Victoria, Australia|Institut für Nuklearmedizin und Endokrinologie, Linz, Austria|UNMC Utrecht, Utrecht, 3051, Netherlands|Mercy Hospital, Auckland, New Zealand"
NCT04672473,Treatment of Malignant Tumors With Antigen Peptide-specific DC-CTL Cells and Decitabine,https://clinicaltrials.gov/study/NCT04672473,UNKNOWN,"Tumor-specific antigens can be induced by demethylation drugs. Antigen-targeting DC-CTL cells supposed to eliminate cancer cells efficiently and specifically. In this study investigators co-culture DCs cells with peptides derived from tumor specific antigen to generate antigen-specific DC-CTLs (Ag-CTL). Following treatment with demethylation drugs, Ag-CTL will be used to eliminate tumor cells. This study aims to evaluate the effectiveness and safety of Ag-CTL combined with demethylation drugs.",NO,Malignant Tumor,BIOLOGICAL: DC-CTL,"PFS, progression free survival time, From date of initial treatment until the date of first documented progression, assessed up to 36 months.","OS, over all survival time, From date of diagnosis until the end of the follow-up, assessed up to 36 months.",,Shenzhen University General Hospital,,ALL,"ADULT, OLDER_ADULT",PHASE1|PHASE2,INTERVENTIONAL,2020-10-30,2023-07-28,"Shenzhen University General Hospital, Shenzhen, Guangdong, 518000, China"
NCT06877650,First-in-Human Investigation of JMT108 Injection in Participants With Advanced Malignant Tumors,https://clinicaltrials.gov/study/NCT06877650,RECRUITING,"This study is designed as an open-label, multi-center Phase 1 clinical study in participants with advanced malignant tumors to evaluate the safety, tolerability, PK characteristics, and preliminary anti-tumor activity of JMT108 injection, and to determine the RP2D/schedule for subsequent studies.",NO,Advanced Malignant Tumors,DRUG: JMT108,"Dose-Limiting Toxicity(DLT), To evaluate the safery of JMT108 in subjects., Approximately 28 days.|Adverse Events (AEs), To evaluate the safery of JMT108 in subjects, through study completion, an average of 1 year","Maximum plasma concentration (Cmax), To evaluate the systemic pharmacokinetics of JMT108 in subjects., through study completion, an average of 1 year",,Shanghai JMT-Bio Inc.,,ALL,"ADULT, OLDER_ADULT",PHASE1,INTERVENTIONAL,2025-04-11,2029-03-30,"Shanghai Pulmonary Hospital, Shanghai, Shanghai, China"
NCT03920371,Evaluation of a Prototype Hand Held Hybrid Gamma Camera,https://clinicaltrials.gov/study/NCT03920371,COMPLETED,The aim of the project is to undertake clinical development of a hybrid compact gamma camera that combines gamma ray and optical imaging. It is an extension of the previous pilot study using a newly developed handheld hybrid compact gamma camera in clinical arena.,NO,Tumour,OTHER: gamma camera imaging,"Agreement of the visualisation of radiopharmaceutical uptake between the hybrid gamma camera and the standard clinical gamma camera for the sites investigated., The subjective assessment of scintigraphic images obtained using the hybrid camera under test and the standard clinical gamma camera.

The image data will be didvdiid into the different exam types and scored using a 3 point scale., 1 year","The clinical optimisation of the hybrid gamma camera image display, Following subjective assessment of the recorded images the data set will be reviewed by experienced observers and the display fusion will be modified to obtain the clearest visualisation of radiopharmaceutical uptake., 1 year",,University of Leicester,Nottingham University Hospitals NHS Trust|University of Nottingham,ALL,"ADULT, OLDER_ADULT",NA,INTERVENTIONAL,2017-06-13,2018-09-10,"University of Leicester, Leicester, LE1 7RH, United Kingdom"
NCT05781555,A Study of Diffusing Alpha Radiation Therapy for Target Treatments of Malignant Tumors,https://clinicaltrials.gov/study/NCT05781555,RECRUITING,"This study is a Compassionate clinical study for the treatment of Malignant Tumors. The primary endpoint of the study is to assess the frequency, severity and causality of acute adverse events related to the DaRT treatment. Adverse events will be assessed and graded according to Common Terminology and Criteria for Adverse Events (CTCAE) version 5.0. The secondary endpoint is to assess the tumor response to DaRT treatment assessed using the Response Evaluation Criteria in Solid Tumors (RECIST) (Version 1.1) 3 months after DaRT seed insertion.",NO,Malignant Tumor,DEVICE: Experimental: DaRT seeds,"To assess the frequency, severity and causality of acute adverse events., The primary endpoint of the study is to assess the frequency, severity and causality of acute adverse events related to the DaRT treatment. Adverse events will be assessed and graded according to Common Terminology and Criteria for Adverse Events (CTCAE) version 5.0., From Day 0 (DaRT insertion )","To assess the tumor response to DaRT treatment, The secondary endpoint is to assess the tumor response to DaRT treatment assessed using the Response Evaluation Criteria in Solid Tumors (RECIST) (Version 1.1), 3 months after DaRT seed insertion",,Alpha Tau Medical LTD.,,ALL,"ADULT, OLDER_ADULT",NA,INTERVENTIONAL,2023-03-22,2025-04,"Hadassah Ein Kerem, Jerusalem, Israel"
