NCT Number,Study Title,Study URL,Study Status,Brief Summary,Study Results,Conditions,Interventions,Primary Outcome Measures,Secondary Outcome Measures,Other Outcome Measures,Sponsor,Collaborators,Sex,Age,Phases,Study Type,Start Date,Completion Date,Locations
NCT05076266,COVID-19 Related Financial Hardship and Distress in Women Who Decline TMIST (EA1151) Participation,https://clinicaltrials.gov/study/NCT05076266,TERMINATED,The purpose of this study is to find out whether factors that lead Women of Color to decline participation in the breast cancer screening trial EA1151 (TMIST) differ from non-women of color.,YES,"Breast Cancer, NOS",OTHER: Questionnaire,"Compare the Proportion of Women of Color (WOC) Participants Who Experience the Composite Outcome of COVID-related Financial Hardship vs Non-WOC Participants, Composite outcome, defined as the logistic modeling of personal changes due to COVID: including layoff or furlough, insurance loss, work hours reduction, new job/increased hours to increase income, food or housing insecurity OR household changes due to COVID: greater or equal to 20% income lose, savings use for living expenses, home sale/refinance, increased debt, declared bankruptcy, at baseline","Compare the Proportions of WOC vs Non-WOC Participants With COVID-related Change in Their Material Condition, a Composite Measure, Outcome is the result of a logistic regression with covariates: \>20% income loss, savings use, home sale or refinance, loans, reaching credit limits, becoming subject to a collection agency, or bankruptcy in the last 3 months (binary), at baseline|Compare the Proportions of WOC vs Non-WOC Participants With COVID-specific Perceived Financial Distress, Adapted from the summary item from COST measure ""COVID-19 has been a financial hardship to my family"" rated from 0=""Not at all"" to 4=""Very much"" Larger Values indicate greater hardship, at baseline|Compare the Proportion of WOC in TMIST Participants vs EAQ201 Participants, The proportions will be determined by calculating the number of women who self-report as non-White versus the total number of participants enrolled., baseline","Compare the Proportion of WOC vs Non-WOC EAQ201 Participants With COVID-related Employment Change, Employment change of any of the following: Self-reported work hours reduction, layoff or furlough, sick time, vacation time use or new job/increased hours to increase income (binary), baseline|Compare the Proportions of WOC vs Non-WOC EAQ201 Participants With COVID-specific Perceived Distress and Perceived Susceptibility to COVID and Breast Cancer, Survey to capture the emotional response to COVID related to fear of infection, financial anxiety, housing and food insecurity. ratings from 0=Not at All to 4=Very Much Single items for breast cancer and COVID-19, modified from previous studies of intention to undergo breast cancer screening. ratings from 5=Definitely will not to 1=Definitely will, baseline|Compare the Proportions of WOC vs Non-WOC EAQ201 Participants With Relative Increase in Smoking and Alcohol Use, Risk Factors for Breast Cancer, Assess change in frequency or amount of tobacco or alcohol use during COVID compared to before COVID. Will not assess absolute amount of use. (categorical) (2 items), baseline|Compare Participant-reported Quality of Life, Anxiety and Depression Between WOC and Non-WOC EAQ201 Participants, Participant-Reported Outcomes Measurement Information System (PROMIS) PROMIS-10 Global Health: Overall Quality of Life physical and mental health assessment. Sum of the 10 item responses (continuous) each item scored: 5=""Excellent to 1=""Poor""; higher values indicate Better Health Continuous score range 10 to 50 with higher values indicating better health PROMIS Anxiety: 4-item Short Form. Sum of item responses (continuous) each item scored: 1=""Never"" to 5=""Always""; higher values indicate greater Anxiety Continuous score range 4 to 20 with higher values indicating greater Anxiety PROMIS Depression: 4-item Short Form. Sum of item responses (continuous) each item scored: 1=""Never"" to 5=""Always""; higher values indicate greater Depression Continuous score range 4 to 20 with higher values indicating greater Depression, baseline|Assess the Effects of Sociodemographic Characteristics, and Federal-, State- or Local-level COVID-19 Factors on TMIST Participation, in WOC vs Non-WOC, Compare maximum number of COVID-19 cases, state unemployment during shelter-in-place, local unemployment during shelter-in-place) on TMIST participation, stratified by WOC vs non-WOC, Through study completion, an average of 1 year",Eastern Cooperative Oncology Group,,FEMALE,"ADULT, OLDER_ADULT",,OBSERVATIONAL,2022-03-14,2023-02-03,"University of Michigan, Ann Arbor, Michigan, 48109, United States"
NCT00876408,Review of Molecular Profiling-Real Time Polymerase Chain Reaction (Rt-Pcr) in Unknown Primary Cancer,https://clinicaltrials.gov/study/NCT00876408,COMPLETED,"This will be a retrospective review of 30 patients with unknown primary cancer who have had commercially available RT-PCR assays performed on biopsied tumors, in order to determine if the assay results are consistent with clinical features and useful for planning initial therapy or changing therapy.",NO,Unknown Primary Cancer,,"To correlate the tissue of origin predicted by the RT-PCR assay with clinical and pathologic features of patients with carcinoma of unknown primary site., 6 months","To correlate the tissue of origin predicted by the RT-PCR with actual primary sites found subsequently in a subset of patients., 6 months|To evaluate the utility of RT-PCR assay results in guiding treatment selection in patients with carcinoma of unknown primary site., 6 months",,"SCRI Development Innovations, LLC","Biotheranostics, Inc.",ALL,"ADULT, OLDER_ADULT",,OBSERVATIONAL,2009-05,2010-11,"Tennessee Oncology, PLLC, Nashville, Tennessee, 37023, United States"
NCT04637256,Evaluation of Outcomes from Treatment of Benign or Malignant Gastroesophageal Diseases,https://clinicaltrials.gov/study/NCT04637256,RECRUITING,"This study will be a retrospective chart review of patients who have been diagnosed with benign or malignant pancreatic disease under the practice of Dr. Rohan Jeyarajah, M.D., Dr. Houssam Osman M.D., and Dr. Edward Cho M.D., Sc.M. at Methodist Health System Hospital in Richardson, TX. The Investigators plan to conduct an analysis of patients meeting the inclusion criteria from 2005 to present. Study will also be conducted by the PI, Sub-Is, surgery fellows, office staff and clinical research coordinator who are delegated to do by the PI. Data will be obtained by looking through either the investigator's patients from their practice or through a national database. Data will be analyzed primarily by the study conductors.",NO,Pancreatic Malignant Neoplasm Primary,,"Overall Survival, We will be examining all treatments of benign or malignant pancreatic cancer by measuring the following outcome: overall survival, 2005 to 2019",,,Methodist Health System,,ALL,"ADULT, OLDER_ADULT",,OBSERVATIONAL,2019-03-06,2025-01-30,"Trinity Surgical Consultants, Methodist Richardson Medical Center, Richardson, Texas, 75082, United States"
NCT02575898,"Feasibility of a Creative Writing Intervention in an Advanced Cancer Population: A Single Arm, Consecutive Cohort Study",https://clinicaltrials.gov/study/NCT02575898,COMPLETED,"To assess the feasibility of a creative writing intervention in an advanced cancer population. Given it is a relatively simple intervention delivered by a non-clinician, the investigators are interested in better understanding its pattern of effect on patient psychological adjustment. The investigators aim to assess its feasibility in this study in order to inform a future larger study that will utilize a control arm.",NO,Primary Malignant Neoplasm of Lung|Primary Malignant Neoplasm of Gastrointestinal Tract,OTHER: First Session|OTHER: Second Session|BEHAVIORAL: Third through Sixth Sessions,"Feasibility of a creative writing intervention in an advanced cancer population, Anyone completing the first intervention with the creative writer will be evaluable for the feasibility outcome. If the investigators see 50% of patients completing 3 months of the creative writing intervention then this would indicate the intervention should be examined in a larger pilot study., 29 months",,,Dartmouth-Hitchcock Medical Center,,ALL,"CHILD, ADULT, OLDER_ADULT",NA,INTERVENTIONAL,2016-01-14,2018-09-04,"Dartmouth-Hitchcock Medical Center, Lebanon, New Hampshire, 03756, United States"
NCT06695871,Research on the Application of Patient Navigation-based Management Model of Patients After LEEP,https://clinicaltrials.gov/study/NCT06695871,NOT_YET_RECRUITING,"Cervical cancer poses a significant threat to women's health and is a crucial public health issue. Early detection and treatment of cervical lesions and standardized management have emerged as essential pillars in the Global Cervical Cancer Elimination. The loop electrosurgical excision procedure (LEEP) is widely employed as a preferred approach for the diagnosis and treatment of precancerous cervical lesions and early invasive cervical cancer. Patients with high-grade cervical lesions are more prone to experiencing sexual dysfunction and psychological disorders after LEEP, attributed to the unique surgical site, physiological alterations, and psychological stress during the postoperative recovery process, thereby adversely affecting their quality of life. Currently, there is a shortage of research evidence regarding targeted intervention measures and long-term effect evaluations for sexual function quality and quality of life after LEEP for cervical lesions. In recent years, the health management model based on patient navigation has evolved into a novel modality for facilitating comprehensive tumor prevention and control. However, its effect in managing cervical lesions has yet to be comprehensively assessed. Therefore, we will design a randomized controlled trial to evaluate the impact of a patient navigation-based health management model on quality of life and sexual function after LEEP in patients with cervical lesions.",NO,Cervical Intraepithelial Neoplasias,OTHER: Patient navigation-based health management,"Quality of Life, The quality of life six months post-surgery was assessed using 36-Item Short Form Survey., six months after LEEP","Sexual function index, The Chinese version of the Female Sexual Function Index was used to evaluate the sexual function index at three time points: before LEEP, three months after LEEP, and six months after LEEP., before LEEP, three months after LEEP, and six months after LEEP|Anxiety, Anxiety symptoms were assessed using the Self-Rating Anxiety Scale at three-time points: before LEEP, three months after LEEP, and six months after LEEP., before LEEP, three months after LEEP, and six months after LEEP|Quality of Life, The quality of life was assessed using 36-Item Short Form Survey., before LEEP and three months after LEEP|Depression, Depression symptoms were assessed using the Self-Rating Anxiety Scale at three time points: before LEEP, three months after LEEP, and six months after LEEP., before LEEP, three months after LEEP, and six months after LEEP|Vaginal discharge, Patient-reported alterations in the volume, color, and odor of vaginal secretions., three and six months after LEEP|Recurrence rates, The recurrence of cervical lesions at three and six months post-surgery was evaluated using high-risk HPV testing, cytology test, and histopathological examination., three and six months after LEEP",,Peking University People's Hospital,,FEMALE,ADULT,NA,INTERVENTIONAL,2024-12-01,2025-12-31,"Peking University People's Hospital, Beijing, Beijing, 100044, China"
NCT00489086,Topical Tazarotene in Treating Patients With Basal Cell Skin Cancer and Basal Cell Nevus Syndrome on the Face,https://clinicaltrials.gov/study/NCT00489086,COMPLETED,"RATIONALE: Drugs used in chemotherapy, such as tazarotene, work in different ways to stop the growth of tumor cells, either by killing the cells or by stopping them from dividing.

PURPOSE: This phase II trial is studying topical tazarotene to see how well it works in treating patients with basal cell skin cancer and basal cell nevus syndrome on the face.",YES,Neoplastic Syndrome,DRUG: tazarotene,"Complete Response Rate, The primary endpoint used to evaluate tazarotene efficacy for BCC chemotherapy was the complete response (CR) rate, defined as the complete visible disappearance of a patient's ""target"" lesion during the the 18 months of tazarotene application and its failure to recur during the ensuing 18-months. We defined surgical removal of a target lesion as a treatment failure. The primary endpoint was assessed based on intention to treat analysis such that any subject who underwent the baseline evaluation and applied at least 1 dose of tazarotene was included in the analysis. Drop-outs were considered non-responders. A priori treatment success for tazarotene was defined as a CR rate of at least 50%, and treatment failure was defined as a CR rate of 25% or less., 36 months","Time to Lesion Clearance, 36 months|Time to Progression, 36 months|Estimated Duration of Complete Response, 36 months|Overall Response at Treated Lesions, 36 months",,UCSF Benioff Children's Hospital Oakland,National Cancer Institute (NCI),ALL,"ADULT, OLDER_ADULT",PHASE2,INTERVENTIONAL,2004-07,2012-06,"Children's Hospital and Research Center Oakland, Oakland, California, 94609, United States|Herbert Irving Comprehensive Cancer Center at Columbia University Medical Center, New York, New York, 10032, United States"
NCT05987098,BBPA PET/CT in Patients With Malignant Tumors,https://clinicaltrials.gov/study/NCT05987098,RECRUITING,"This study is an open-labeled phase II diagnostic clinical trial to explore the safety and clinical value of BBPA-PET/CT in suspected malignant tumor patients. The investigation regarding the clinical value of BBPA concerning the metabolic characteristics of BBPA in suspected malignant tumors. Quantitative features will be extracted to analysis the PET images. For patient who took surgery after multiple examination, histopathology, molecular pathology and LAT-1 immunohistochemistry will also be obtained.",NO,Malignant Tumors,DIAGNOSTIC_TEST: BBPA PET examination,"standardized uptake value (SUV) for BBPA, SUV reflects the uptake of PET tracers, and quantitative imaging features such as SUVmax, SUVmean, and visually assessed features will be measured in the evaluation of tumors., 1 week","Adverse events, Adverse event within 1 week after BBPA injection will be documented., 1 week",,Peking Union Medical College Hospital,Peking University|Peking University Cancer Hospital & Institute,ALL,"ADULT, OLDER_ADULT",NA,INTERVENTIONAL,2021-03-22,2024-09-01,"Wenbin Ma, Beijing, Beijing, 10005, China"
NCT05714748,Application of mRNA Immunotherapy Technology in Epstein-Barr Virus-related Refractory Malignant Tumors,https://clinicaltrials.gov/study/NCT05714748,UNKNOWN,The purpose of this study is to evaluate the efficacy and safety of mRNA vaccine for the EBV-positive Advanced Malignant Tumors.,NO,Malignant Tumors,BIOLOGICAL: EBV mRNA vaccine,"Adverse events, Adverse events defined as the number of participants with adverse events according, up to 12 months|Objective response rate, ORR is defined as the percentage of patients who achieve a response, which can either be complete response (complete disappearance of lesions) or partial response (reduction in the sum of maximal tumor diameters by at least 30% or more), up to 12 months|Progress-Free Survival, PFS is defined as the time from the administration of the first dose to first disease, up to 12 months|Overall Survival, OS is defined as the time from the administration of the first dose to death., up to 12 months",,,West China Hospital,,ALL,"ADULT, OLDER_ADULT",PHASE1,INTERVENTIONAL,2022-11-18,2025-01,"West China Hospital, Sichuan University, Chengdu, Sichuan, 610041, China"
NCT03266042,Registry Protocol- Melphalan Percutaneous Hepatic Perfusion for the Treatment of Unresectable Hepatic Malignancy,https://clinicaltrials.gov/study/NCT03266042,UNKNOWN,"Collection of Safety, Efficacy and Resource Utilization Information in Patients Who Have Received Melphalan PHP with the Delcath Hepatic Delivery System for the Treatment of Unresectable Hepatic Malignancy",NO,Hepatic Malignant Neoplasm Primary Non-Resectable,,"Gather key safety data on the use of CHEMOSAT Kit (Gen 2 filter)., Data to be collected at: Baseline, treatment and post treatment laboratory values and clinical measurements until time of discharge, Post-procedure (up to 30 days after CS-PHP)","Percentage of treatment with CHEMOSAT each patient receives, The percentage of treatments with CHEMOSAT each patient receives based on primary tumor, From the first CHEMOSAT treatment through the last, [timeframe an average of 12-months if 6 cycles completed]|Evaluation of Best Overall Response, Evaluation of patient best overall response (partial response or complete response, when applicable), from the date of first CHEMOSAT treatment through last CHEMOSAT treatment, or treatment discontinuation or death (whichever occurs first) [assessed up to 24 months]|Evaluation of resource utilization, Percentage of days spent in ICU, step-down area, From the first CHEMOSAT treatment through the last CHEMOSAT treatment [assessed up to 24 months]|Evaluate time to treatment failure, Time of first CHEMOSAT treatment to time of treatment failure, time from first CHEMOSAT treatment to the date of last CHEMOSAT treatment [assesed up to 24 months]",,Delcath Systems Inc.,,ALL,"CHILD, ADULT, OLDER_ADULT",,OBSERVATIONAL,2016-01-14,2020-02,"Southampton University Hospitals and University of Southampton, Southampton, United Kingdom|Spire Southampton Hospital, Southampton, United Kingdom"
NCT06944444,A Phase I Clinical Study of SSS59 Monotherapy in Patients With Advanced Malignant Tumors,https://clinicaltrials.gov/study/NCT06944444,RECRUITING,"This study was an open-label phase I study to evaluate the safety, pharmacokinetics, and antitumor activity of SSS59 as a single agent in patients with advanced malignancies.",NO,Malignant Tumors,DRUG: SSS59,"DLTs, Dose limiting toxicity, 21 days|Safety and tolerability, Safety and tolerability assessed by incidence and severity of adverse events, during the intervention，Within 28 days of the last dose|MTD and RP2D, Determine the maximum tolerated dose and determine the recommended phase II dose, through study completion, an average of 2 year","Cmax of SSS59, Maximum concentration, baseline, during the intervention and at the end of the study|Tmax of SSS59, Time to peak drug concentration, baseline, during the intervention and at the end of the study|AUC0-last of SSS59, the area under the curve (AUC) up to the last measurable concentration, baseline, during the intervention and at the end of the study|RO of SSS59, Receptor Occupancy, baseline, during the intervention and at the end of the study|Pharmacodynamic (PD) characteristics of SSS59, change of cytokine, baseline, during the intervention and at the end of the study|Immunogenicity of SSS59, ADA，NAB（if ADA is positive）, baseline, during the intervention and at the end of the study|Preliminary antitumor activity of SSS59, Assessed according to Recist V1.1, baseline, during the intervention and at the end of the study",,"Shenyang Sunshine Pharmaceutical Co., LTD.",,ALL,"ADULT, OLDER_ADULT",PHASE1,INTERVENTIONAL,2025-04-27,2027-12-31,"Shanghai First People's Hospital, Shanghai, Shanghai, China"
NCT02534506,Study of Urelumab in Subjects With Advanced and/or Metastatic Malignant Tumors,https://clinicaltrials.gov/study/NCT02534506,COMPLETED,The purpose of this study is to assess the safety and tolerability of BMS-663513 in subjects with advanced and/or metastatic malignant tumors.,NO,Malignant Tumors,DRUG: Urelumab|DRUG: Nivolumab,"Safety of urelumab monotherapy as measured by the dose limiting toxicity (DLT) in subjects with advanced and/or metastatic malignant tumors, From day 1 of treatment up to 60 days of follow-up|Safety of urelumab monotherapy as measured by adverse events (AEs) and serious adverse events (SAEs) in subjects with advanced and/or metastatic malignant tumors, From day 1 of treatment up to 60 days of follow-up|Tolerability of urelumab monotherapy as measured by the DLT in subjects with advanced and/or metastatic malignant tumors, From day 1 of treatment up to 60 days of follow-up|Tolerability of urelumab monotherapy as measured by AEs and SAEs in subjects with advanced and/or metastatic malignant tumors, From day 1 of treatment up to 60 days of follow-up","Safety of urelumab-nivolumab combination therapy as measured by AEs and SAEs in subjects with advanced and/or metastatic malignant tumors, From day 1 of treatment up to 100 days of follow-up|Tolerability of urelumab-nivolumab combination therapy as measured by AEs and SAEs in subjects with advanced and/or metastatic malignant tumors, From day 1 of treatment up to 100 days of follow-up|Cmax (Maximum observed serum concentration) of urelumab when administered alone, 21 days/cycle for Urelumab monotherapy, Cycle 1, 2, 3, 4, 5, 6, 7, 12, 16, up to 60 days of follow up|Ctrough (Trough observed serum concentration) of urelumab when administered alone, 21 days/cycle for Urelumab monotherapy, Cycle 1, 2, 3, 4, 5, 6, 7, 12, 16, up to 60 days of follow up|Tmax (Time of maximum observed serum concentration) of urelumab when administered alone, 21 days/cycle for Urelumab monotherapy, Cycle 1, 2, 3, 4, 5, 6, 7, 12, 16, up to 60 days of follow up|AUC(0-T) [Area under the concentration-time curve from time zero to the last quantifiable concentration] of urelumab when administered alone, 21 days/cycle for Urelumab monotherapy, Cycle 1, 2, 3, 4, 5, 6, 7, 12, 16, up to 60 days of follow up|AUC(TAU) [Area under the concentration-time curve in one dosing interval] of urelumab when administered alone, 21 days/cycle for Urelumab monotherapy, Cycle 1, 2, 3, 4, 5, 6, 7, 12, 16, up to 60 days of follow up|AUC(INF) [Area under the concentration-time curve from time zero to infinity and the extrapolated area] of urelumab when administered alone, 21 days/cycle for Urelumab monotherapy, Cycle 1, 2, 3, 4, 5, 6, 7, 12, 16, up to 60 days of follow up|T-HALF (Elimination half life) of urelumab when administered alone, 21 days/cycle for Urelumab monotherapy, Cycle 1, 2, 3, 4, 5, 6, 7, 12, 16, up to 60 days of follow up|CLT (Total body clearance) of urelumab when administered alone, 21 days/cycle for Urelumab monotherapy, Cycle 1, 2, 3, 4, 5, 6, 7, 12, 16, up to 60 days of follow up|Vss (Volume of distribution at steady state) of urelumab when administered alone, 21 days/cycle for Urelumab monotherapy, Cycle 1, 2, 3, 4, 5, 6, 7, 12, 16, up to 60 days of follow up|AI (Accumulation Index: ratio of AUC(TAU) and Cmax in cycle at steady state to those after the first cycle) of urelumab when administered alone, 21 days/cycle for Urelumab monotherapy, Cycle 1, 2, 3, 4, 5, 6, 7, 12, 16, up to 60 days of follow up|Cmax of urelumab when co-administered, 28 days/cycle for combination therapy of Urelumab and Nivolumab, Cycle 1, 2, 3, 4, 5, 6, 9, up to 100 days of follow up|Coeff of urelumab when co-administered, 28 days/cycle for combination therapy of Urelumab and Nivolumab, Cycle 1, 2, 3, 4, 5, 6, 9, up to 100 days of follow up|Ctrough of urelumab and nivolumab when co-administered, 28 days/cycle for combination therapy of Urelumab and Nivolumab, Cycle 1, 2, 3, 4, 5, 6, 9, up to 100 days of follow up|Tmax of urelumab and nivolumab when co-administered, 28 days/cycle for combination therapy of Urelumab and Nivolumab, Cycle 1, 2, 3, 4, 5, 6, 9, up to 100 days of follow up|AUC(0-T) of urelumab and nivolumab when co-administered, 28 days/cycle for combination therapy of Urelumab and Nivolumab, Cycle 1, 2, 3, 4, 5, 6, 9, up to 100 days of follow up|AUC(TAU) of urelumab and nivolumab when co-administered, 28 days/cycle for combination therapy of Urelumab and Nivolumab, Cycle 1, 2, 3, 4, 5, 6, 9, up to 100 days of follow up|AUC(INF) of urelumab and nivolumab when co-administered, 28 days/cycle for combination therapy of Urelumab and Nivolumab, Cycle 1, 2, 3, 4, 5, 6, 9, up to 100 days of follow up|T-HALF of urelumab when co-administered, 28 days/cycle for combination therapy of Urelumab and Nivolumab, Cycle 1, 2, 3, 4, 5, 6, 9, up to 100 days of follow up|CLT of urelumab when co-administered, 28 days/cycle for combination therapy of Urelumab and Nivolumab, Cycle 1, 2, 3, 4, 5, 6, 9, up to 100 days of follow up|Vss of urelumab when co-administered, 28 days/cycle for combination therapy of Urelumab and Nivolumab, Cycle 1, 2, 3, 4, 5, 6, 9, up to 100 days of follow up|Anti-drug Antibody (ADA) status of the subject in response to Urelumab when administered alone, 21 days/cycle for Urelumab monotherapy, Cycle 1, 2, 4, 8, 12, 16, up to 60 days of follow up|ADA status of the subject in response to Urelumab and Nivolumab when co-administered, 28 days/cycle for combination therapy of Urelumab and Nivolumab, Cycle 1, 2, 4, 5, 9, up to 100 days of follow up|Best overall response (BOR) of urelumab monotherapy, Every 6-8 weeks during the treatment period|BOR of urelumab and nivolumab combination therapy, Every 6-8 weeks during the treatment period",,Bristol-Myers Squibb,Ono Pharmaceutical Co. Ltd,ALL,"ADULT, OLDER_ADULT",PHASE1,INTERVENTIONAL,2015-11-06,2016-11-11,"Local Institution, Kobe-shi, Hyogo, 6500017, Japan"
