NCT Number,Study Title,Study URL,Study Status,Brief Summary,Study Results,Conditions,Interventions,Primary Outcome Measures,Secondary Outcome Measures,Other Outcome Measures,Sponsor,Collaborators,Sex,Age,Phases,Study Type,Start Date,Completion Date,Locations
NCT04414150,A Trial of SHR-1802 in Patients With Failure of Standard Treatment for Advanced Malignant Tumours,https://clinicaltrials.gov/study/NCT04414150,COMPLETED,This is the first study to test SHR-1802 in humans. The primary purpose of this study is to see if SHR-1802 is safe and tolerable for patients with locally advanced/unresectable or metastatic malignancies that are refractory to available therapy or for which no standard therapy is available.,NO,Malignant Tumours,DRUG: SHR-1802,"Dose limiting toxicity, Days 1-21","Percentage of patients with adverse events, from the first drug administration to within 90 days for the last SHR-1802 dose|Rates of dose suspension, dose reduction and dose discontinuation caused by investigational drug related adverse events, At pre-defined intervals from initial dose up to 24 months|ORR, At pre-defined intervals from initial dose up to 24 months|DOR, At pre-defined intervals from initial dose up to 24 months|DCR, At pre-defined intervals from initial dose up to 24 months|PFS, At pre-defined intervals from initial dose up to 24 months|Maximum Concentration (Cmax) of SHR-1802, At pre-defined intervals from initial dose through final study visit (up to 24 months)|Time of Maximum Concentration (Tmax) of SHR-1802, At pre-defined intervals from initial dose through final study visit (up to 24 months)|Area Under the Curve (AUC) of SHR-1802, At pre-defined intervals from initial dose through final study visit (up to 24 months)|Terminal Half-Life (T1/2) of SHR-1802, At pre-defined intervals from initial dose through final study visit (up to 24 months)|Clearance (CL) of SHR-1802, At pre-defined intervals from initial dose through final study visit (up to 24 months)|Volume of Distribution at Steady State (Vss) of SHR-1802, At pre-defined intervals from initial dose through final study visit (up to 24 months)|Evaluation of the immunogenicity of SHR-1802, Serum sampling to assess the potential for anti-drug antibody (ADA) formation., At pre-defined intervals from initial dose through final study visit (up to 24 months)",,"Jiangsu HengRui Medicine Co., Ltd.",,ALL,"ADULT, OLDER_ADULT",PHASE1,INTERVENTIONAL,2020-06-17,2022-03-15,"Tianjin Medical University Cancer Institute and Hospital, Tianjin, Tianjin, 300060, China"
NCT04125524,Terahertz Metamaterials for Tumour Marker Concentration Identification,https://clinicaltrials.gov/study/NCT04125524,SUSPENDED,"The research the investigators plan to undertake involves the use of a metamaterial at terahertz frequencies. Serum samples will be tested using the metamaterial to determine if this method can be used to measure the concentration of tumour markers present in the sample. Patients who have been tested for CEA, LDH, CA-125, CA 19-9, CA 15-3, total-hCG and AFP will be used for both the positive and negative samples.",NO,Malignant Tumour,DIAGNOSTIC_TEST: Terahertz metamaterials,"Evidence of detection for any marker, Any correlation showing a difference between samples with marker concentrations above and below the standard threshold values used for tests within the NHS., 18 months","Quantifying the quality of detection per marker, Percentage of detectable samples for each specific marker which showed any evidence of detection in outcome 1., 18 months",,Durham University,County Durham and Darlington NHS Foundation Trust,ALL,"ADULT, OLDER_ADULT",,OBSERVATIONAL,2021-05-17,2025-10-01,"Department of Engineering Durham University, Durham, DH1 3LE, United Kingdom"
NCT06383871,A Phase I Clinical Study of HRS-7058 in Patients With Advanced Malignant Tumour,https://clinicaltrials.gov/study/NCT06383871,NOT_YET_RECRUITING,"This study is a multicentre, open phase I clinical study of dose escalation, dose extension and efficacy extension of HRS-7058 in subjects with advanced malignant tumour. To evaluate the safety, tolerability, pharmacokinetics and efficacy of HRS-7058.",NO,Advanced Malignant Tumour,DRUG: HRS-7058 capsule/ HRS-7058 tablet,"Dose-limiting toxicity (DLT), From the beginning of first patient in (FPI) to the end of dose escalation phase up to approximately 10 months|maximum tolerated dose (MTD), From the beginning of first patient in (FPI) to the end of dose escalation phase up to approximately 10 months|Phase II recommended dose (RP2D), From the beginning of first patient in (FPI) to the end of dose escalation phase up to approximately 10 months|Safety endpoints: adverse events (AE), From the beginning of first patient in (FPI) to the end of study up to approximately 21 months]","Efficacy endpoints: Objective response rate (ORR) assessed based on RECIST v1.1 criterion, From the beginning of first patient in (FPI) to the end of study up to approximately 21 months|Efficacy endpoints: duration of response (DoR) assessed based on RECIST v1.1 criterion, From the beginning of first patient in (FPI) to the end of study up to approximately 21 months|Efficacy endpoints: disease control rate (DCR) assessed based on RECIST v1.1 criterion, From the beginn ing of first patient in (FPI) to the end of study up to approximately 21 months|Efficacy endpoints: progression-free survival (PFS) assessed based on RECIST v1.1 criterion, From the beginn ing of first patient in (FPI) to the end of study up to approximately 21 months|Efficacy endpoints: overall survival (OS), From the beginn ing of first patient in (FPI) to the end of study up to approximately 21 months",,"Shandong Suncadia Medicine Co., Ltd.",,ALL,"ADULT, OLDER_ADULT",PHASE1,INTERVENTIONAL,2024-04,2026-06,
NCT06915142,A Phase II Clinical Study of HRS-7058 in Combination With Antitumor Drugs in Patients With Advanced Malignant Tumour,https://clinicaltrials.gov/study/NCT06915142,NOT_YET_RECRUITING,"This study is a multicentre, open phase II clinical study of dose escalation, dose extension and efficacy extension of HRS-7058 in combination with antitumor drugs in subjects with advanced malignant tumour. To evaluate the safety, tolerability and efficacy of HRS-7058 in combination with antitumor drugs.",NO,Advanced Malignant Tumour,DRUG: HRS-7058 + SHR-1316|DRUG: HRS-7058 + SHR-1316 + Platinum-containing doublet chemotherapy|DRUG: HRS-7058 + Cetuximab|DRUG: HRS-7058 + SHR-1826|DRUG: HRS-7058 + SHR-1826 + SHR-1316,"Dose-limiting toxicity (DLT) (Dose Escalation and Dose Expansion), From the beginning of first patient in (FPI) to the end of dose expansion phase up to approximately 10 months|Safety endpoints: adverse events (AE) (Dose Escalation and Dose Expansion), From the beginning of first patient in (FPI) to the end of dose expansion phase up to approximately 10 months]|Phase II recommended dose (RP2D)(Dose Escalation and Dose Expansion), From the beginning of first patient in (FPI) to the end of dose expansion phase up to approximately 10 months]|Efficacy endpoints: Objective response rate (ORR) assessed based on RECIST v1.1 criterion (Efficacy Expansion), From the beginning of first patient in (FPI) to the end of study up to approximately 32 months","Efficacy endpoints: Objective response rate (ORR) assessed based on RECIST v1.1 criterion (Dose Escalation and Dose Expansion), From the beginning of first patient in (FPI) to the end of dose expansion phase up to approximately 10 months|Efficacy endpoints: disease control rate (DCR) assessed based on RECIST v1.1 criterion (Dose Escalation and Dose Expansion), From the beginning of first patient in (FPI) to the end of dose expansion phase up to approximately 10 months|Efficacy endpoints: duration of response (DoR) assessed based on RECIST v1.1 criterion (Dose Escalation and Dose Expansion), From the beginning of first patient in (FPI) to the end of dose expansion phase up to approximately 10 months|Efficacy endpoints: progression-free survival (PFS) assessed based on RECIST v1.1 criterion (Dose Escalation and Dose Expansion), From the beginning of first patient in (FPI) to the end of dose expansion phase up to approximately 10 months|Efficacy endpoints: overall survival (OS)(Dose Escalation and Dose Expansion), From the beginning of first patient in (FPI) to the end of dose expansion phase up to approximately 10 months|Efficacy endpoints: disease control rate (DCR) assessed based on RECIST v1.1 criterion (Efficacy Expansion), From the beginning of first patient in (FPI) to the end of study up to approximately 32 months|Efficacy endpoints: duration of response (DoR) assessed based on RECIST v1.1 criterion (Efficacy Expansion), From the beginning of first patient in (FPI) to the end of study up to approximately 32 months|Efficacy endpoints: progression-free survival (PFS) assessed based on RECIST v1.1 criterion (Efficacy Expansion), From the beginning of first patient in (FPI) to the end of study up to approximately 32 months|Efficacy endpoints: overall survival (OS) (Efficacy Expansion), From the beginning of first patient in (FPI) to the end of study up to approximately 32 months|Safety endpoints: adverse events (AE)(Efficacy Expansion), From the beginning of first patient in (FPI) to the end of study up to approximately 32 months",,"Shandong Suncadia Medicine Co., Ltd.",,ALL,"ADULT, OLDER_ADULT",PHASE2,INTERVENTIONAL,2025-04,2027-10,"Tianjin Cancer Hospital, Tianjin, Tianjin, 300060, China"
NCT06926972,NutritiOUs fRuIts and veggieS to Improve Health: A Culinary Medicine Intervention,https://clinicaltrials.gov/study/NCT06926972,RECRUITING,"This study includes a 12-week culinary medicine intervention integrated within the existing YMCA Suncoast Survivorship and Wellness Program Powered by Moffitt. Members of the John Geigle YMCA will be assigned to the NOURISH intervention, which includes biweekly provision of fruit and vegetable bundles, recipe cards, and nutritional education handouts plus 30-minute culinary medicine demonstrations with skill-building training (six total demonstrations focused on fruit and vegetable recipes).",NO,"Cancer, Nos",OTHER: NOURISH,"Participant Recruitment Rate, Number of participants successfully recruited to the study., Up to 1 year|Participant Retention, The proportion of participants who complete the study., Up to 1 year",,,H. Lee Moffitt Cancer Center and Research Institute,,ALL,"ADULT, OLDER_ADULT",NA,INTERVENTIONAL,2025-04-04,2026-04,"Moffitt Cancer Center, Tampa, Florida, 33612, United States"
NCT03621124,Maladaptive Adipose Tissue Activity in Cancer,https://clinicaltrials.gov/study/NCT03621124,TERMINATED,"The purpose of this pilot research is to study brown adipose tissue, a type of fat that increases metabolism (burns energy) during exposure to cold, and how it may contribute to the weight loss observed in cancer.",NO,Cancer Nos,PROCEDURE: Resting Energy Expenditure|OTHER: Thermal Comfort Questionnaire,"Difference in resting energy expenditure between brown adipose tissue (BAT)-positive and BAT-negative patients with cancer., Characterization of the energy metabolism profiles of cancer patients with and without evidence of BAT activation will be assessed utilizing one sided t-test., 27 Months","Difference in energy expenditure between room temperature and response to warm exposure (energy expenditure) in BAT-positive and BAT-negative cancer patients., Assessment of environmental modulation as an effective strategy to mitigate maladaptive BAT activation in patients with malignancy will be assessed by two-sided t-test., 27 Months",,Virginia Commonwealth University,National Cancer Institute (NCI),ALL,"ADULT, OLDER_ADULT",,OBSERVATIONAL,2018-08-16,2020-05-20,"Virginia Commonwealth University/ Massey Cancer Center, Richmond, Virginia, 23298-0070, United States"
NCT01750580,Safety Study of BMS-986015 (Anti-KIR) in Combination With Ipilimumab in Subjects With Selected Advanced Tumor,https://clinicaltrials.gov/study/NCT01750580,COMPLETED,"To assess the safety and tolerability, characterize the dose-limiting toxicities (DLTs), and identify the maximally tolerated dose (MTD) of BMS-986015 given in combination with ipilimumab in subjects with select advanced (metastatic and/or unresectable) solid tumors.",NO,"CANCER, NOS",DRUG: Lirilumab|DRUG: Ipilimumab,"Safety as measured by the rate of adverse events, and serious adverse events, Approximately 510 days","Efficacy as measured by tumor assessment, Assessed from the start of treatment (ay 1) to the end of treatment (week 60) and for 90 days in follow-up|The maximum observed serum concentration (Cmax) of BMS-986015 and Ipilimumab, up to 18 timepoints following each dose during Weeks 1, (0h, EOI and 24h), 2, 3, 4, 10, (0h, EOI and 24h), 11, 13, 24, (0h and EOI), 36, 48, 60, follow-up 1 and follow-up 2. (EOI is end of infusion, EOT is end of treatment|The time of maximum observed serum concentration (Tmax) of BMS-986015 and Ipilimumab, up to 18 timepoints following each dose during Weeks 1, (0h, EOI and 24h), 2, 3, 4, 10, (0h, EOI and 24h), 11, 13, 24, (0h and EOI), 36, 48, 60, follow-up 1 and follow-up 2|Area under the serum concentration-time curve in one dosing interval [AUC(TAU)] of BMS-986015 and Ipilimumab, up to 18 timepoints following each dose during Weeks 1, (0h, EOI and 24h), 2, 3, 4, 10, (0h, EOI and 24h), 11, 13, 24, (0h and EOI), 36, 48, 60, follow-up 1 and follow-up 2|Area under the serum concentration-time curve from time zero extrapolated to infinite time [AUC(INF)] of BMS-986015 and Ipilimumab, up to 18 timepoints following each dose during Weeks 1, (0h, EOI and 24h), 2, 3, 4, 10, (0h, EOI and 24h), 11, 13, 24, (0h and EOI), 36, EOT, follow-up 1 and follow-up 2|Apparent total body clearance (CL) of BMS-986015 and Ipilimumab, up to 18 timepoints following each dose during Weeks 1, (0h, EOI and 24h), 2, 3, 4, 10, (0h, EOI and 24h), 11, 13, 24, (0h and EOI), 36, 48, 60, follow-up 1 and follow-up 2|Apparent volume of distribution at steady state (Vss) of BMS-986015 and Ipilimumab, up to 18 timepoints following each dose during Weeks 1, (0h, EOI and 24h), 2, 3, 4, 10, (0h, EOI and 24h), 11, 13, 24, (0h and EOI), 36, 48, 60, follow-up 1 and follow-up 2|Serum half-life (T-HALF) of BMS-986015 and Ipilimumab, up to 18 timepoints following each dose during Weeks 1, (0h, EOI and 24h), 2, 3, 4, 10, (0h, EOI and 24h), 11, 13, 24, (0h and EOI), 36, 48, 60, follow-up 1 and follow-up 2|Trough observed serum concentration (Cmin) of BMS-986015 and Ipilimumab, up to 18 timepoints following each dose during Weeks 1, (0h, EOI and 24h), 2, 3, 4, 10, (0h, EOI and 24h), 11, 13, 24, (0h and EOI), 36, 48, 60, follow-up 1 and follow-up 2|Immunogenicity as measured by the incidence of Ipilimumab and anti-Killer cell immunoglobulin-like receptor (KIR) (BMS-986015) anti-drug antibodies (ADA), up to 11 timepoints during Weeks 1, 3, 4, 10, 13, 24, 36,48, 60, follow-up 1 and follow-up 2",,Bristol-Myers Squibb,,ALL,"ADULT, OLDER_ADULT",PHASE1,INTERVENTIONAL,2012-12,2015-04,"H. Lee Moffitt Cancer Center & Research Institute, Tampa, Florida, 33612, United States|Dana Farber Cancer Institute, Boston, Massachusetts, 02215, United States|University Of Minnesota, Minneapolis, Minnesota, 55455, United States|Memorial Sloan Kettering Cancer Ctr, New York, New York, 10065, United States|The Ohio State University, Columbus, Ohio, 43210, United States|Sarah Cannon Research Institute, Nashville, Tennessee, 37203, United States"
NCT06929195,Clinical Trial to Evaluate the Tolerance of TQB2210 Injection,https://clinicaltrials.gov/study/NCT06929195,NOT_YET_RECRUITING,"TQB2210 injection is a humanized monoclonal antibody against FGFR2b, which can bind to FGFR2b with high specificity and inhibit tumor growth by blocking the signaling pathway mediated by fibroblast growth factor receptor. The aim of this experiment is to evaluate the tolerability, pharmacokinetics, and preliminary efficacy of TQB2210 injection in patients with advanced malignant tumors, and to assess its effectiveness and phase II recommended dose (RP2D) in advanced malignant tumors with FGFR2b overexpression, such as advanced gastric/gastroesophageal junction cancer.",NO,Advanced Malignant Tumours,DRUG: TQB2210 Injection,"Dose Limiting Toxicity (DLT), DLT will be defined as toxicities that meet pre-defined severity criteria(according to the NCI CTCAE v5.0 toxicity assessment criteria), and assessed as having a suspected relationship to study drug that occurred within the first cycle(28 days) of treatment., During the first cycle. Each cycle is 28 days|Maximum tolerated dose (MTD), MTD was defined as the highest dose at which dose-limiting toxicity (DLT) occurred in less than 33% of patients., During the first cycle. Each cycle is 28 days|Recommended Phase II Dose, The recommended dosage for subsequent Phase II studies will be based on MTD (Maximum Tolerant Dose), pharmacokinetics, preliminary efficacy and safety comprehensively determined., During the first cycle. Each cycle is 28 days|Objective Response Rate (ORR) (dose expansion phase), Defined as the percentage of Complete Response (CR) plus partial response (PR) assessed by Response Evaluation Criteria In Solid Tumors (RECIST) v1.1 criteria., Up to 2 years","Adverse event rate, The occurrence of all adverse events (AEs), serious adverse events (SAEs) and treatment-related adverse events (TEAEs) evaluated by Common Terminology Criteria for Adverse Events (CTCAE) 5.0., Up to 2 years|Objective Response Rate (ORR) (dose escalation phase), Defined as the percentage of Complete Response (CR) plus partial response (PR) assessed by Response Evaluation Criteria In Solid Tumors (RECIST) v1.1 criteria., Up to 2 years|Disease control rate (DCR), Defined as the proportion of subjects with CR, PR, or Stable Disease (SD)., Up to 2 years|Duration of Response (DOR), Defined as the time from first documented response to documented disease progression., Up to 2 years|Progress Free Survival (PFS), Defined as the time from the first dose of TQB2210 to the first occurrence of disease progression or death from any cause., Up to 2 years|Overall Survival (OS), Overall survival refers to the time from the first treatment to death from any cause., Up to 2 years|Pharmacokinetics: The area under the curve (AUC), The area under the curve (AUC) of serum concentration of TQB2210., 2 hours pre-dose, 0,2,6,24,48,72,120,168 hours after dose on cycle1 day1 and cycle3 day1; 2 hours pre-dose on cycle1 day15 and cycle3 day15, each cycle is 28 days.|Pharmacokinetics:Peak concentration (Cmax), Maximum observed concentration (Cmax) of TQB2210 antibody., 2 hours pre-dose, 0,2,6,24,48,72,120,168 hours after dose on cycle1 day1 and cycle3 day1; 2 hours pre-dose on cycle1 day15 and cycle3 day15, each cycle is 28 days.|Pharmacokinetics: T1/2, Terminal half-life (T1/2), 2 hours pre-dose, 0,2,6,24,48,72,120,168 hours after dose on cycle1 day1 and cycle3 day1; 2 hours pre-dose on cycle1 day15 and cycle3 day15, each cycle is 28 days.|Pharmacokinetics: Apparent Clearance (CL/F), Apparent Clearance： Apparent clearance refers to the rate of drug removal in the body, which reflects the degree of drug elimination in the body, as well as the bioavailability of the drug in the body, 2 hours pre-dose, 0,2,6,24,48,72,120,168 hours after dose on cycle1 day1 and cycle3 day1; 2 hours pre-dose on cycle1 day15 and cycle3 day15, each cycle is 28 days.|Pharmacokinetics: Vss/F, When the drug distribution in plasma and tissue reaches equilibrium, the drug distribution in the body body according to the plasma drug concentration at this time is the required body fluid volume called apparent distribution volume., 2 hours pre-dose, 0,2,6,24,48,72,120,168 hours after dose on cycle1 day1 and cycle3 day1; 2 hours pre-dose on cycle1 day15 and cycle3 day15, each cycle is 28 days.|Immunogenicity: The incidence of drug-resistant antibodies (ADA) and neutralizing antibodies (NAb), The incidence of drug-resistant antibodies (ADA) and neutralizing antibodies (NAb), Cycle1 Day1, Cycle2 Day1, Cycle6 Day1; Cycle12 Day1: pre-dose 120 minutes; At the end of treatment visit (EOT) 30 days after the end of the infusion. Each cycle is 28 days.",,"Chia Tai Tianqing Pharmaceutical Group Nanjing Shunxin Pharmaceutical Co., Ltd.",,ALL,"ADULT, OLDER_ADULT",PHASE1,INTERVENTIONAL,2025-04,2027-04,"Cancer Hospital of Chinese Academy of Medical Sciences, Beijing, Beijing, 100021, China|Chongqing University Cancer Hospital, Chongqing, Chongqing, 400030, China|ZhuJiang Hospital of Southern Medical University, Guangzhou, Guangdong, 510000, China|The Henan Cancer Hospital, Zhengzhou, Henan, 450008, China|Hunan Provincial People's Hospital (The First Affiliated Hospital of Hunan Normal University), Changsha, Hunan, 410005, China|Zhongshan Hospital Fudan University, Shanghai, Shanghai, 200032, China|Zhejiang Cancer Hospital, Hangzhou, Zhejiang, 310022, China"
